[
  {
    "slug": "lula",
    "nome_completo": "Luiz Inacio Lula da Silva",
    "nome_urna": "Lula",
    "cargo_disputado": "Presidente",
    "ids": {
      "camara": 139289,
      "senado": null,
      "tse_sq_candidato": {
        "2018": "280000625869",
        "2022": "280001607829"
      }
    },
    "wikipedia_title": "Luiz_Inácio_Lula_da_Silva"
  },
  {
    "slug": "flavio-bolsonaro",
    "nome_completo": "Flavio Nantes Bolsonaro",
    "nome_urna": "Flavio Bolsonaro",
    "cargo_disputado": "Presidente",
    "estado": "RJ",
    "ids": {
      "camara": null,
      "senado": 5894,
      "tse_sq_candidato": {
        "2002": "851",
        "2006": "10354",
        "2010": "190000000070",
        "2014": "190000000095",
        "2016": "190000011736",
        "2018": "190000614721"
      }
    },
    "wikipedia_title": "Flávio_Bolsonaro"
  },
  {
    "slug": "romeu-zema",
    "nome_completo": "Romeu Zema Neto",
    "nome_urna": "Romeu Zema",
    "cargo_disputado": "Presidente",
    "ids": {
      "camara": null,
      "senado": null,
      "tse_sq_candidato": {
        "2018": "130000600702",
        "2022": "130001701690"
      }
    },
    "wikipedia_title": "Romeu_Zema"
  },
  {
    "slug": "ronaldo-caiado",
    "nome_completo": "Ronaldo Ramos Caiado",
    "nome_urna": "Ronaldo Caiado",
    "cargo_disputado": "Presidente",
    "ids": {
      "camara": 74813,
      "senado": 456,
      "tse_sq_candidato": {
        "2018": "90000613470",
        "2022": "90001646326"
      }
    },
    "wikipedia_title": "Ronaldo_Caiado"
  },
  {
    "slug": "ratinho-junior",
    "nome_completo": "Carlos Roberto Massa Junior",
    "nome_urna": "Ratinho Junior",
    "cargo_disputado": "Presidente",
    "ids": {
      "camara": 141403,
      "senado": null,
      "tse_sq_candidato": {
        "2010": "160000000790",
        "2012": "160000019324",
        "2014": "160000000848",
        "2018": "160000609226",
        "2022": "160001614467"
      }
    },
    "wikipedia_title": "Ratinho_Júnior"
  },
  {
    "slug": "aldo-rebelo",
    "nome_completo": "Jose Aldo Rebelo Figueiredo",
    "nome_urna": "Aldo Rebelo",
    "cargo_disputado": "Presidente",
    "ids": {
      "camara": 73428,
      "senado": null,
      "tse_sq_candidato": {
        "2022": "250001639699"
      }
    },
    "wikipedia_title": "Aldo_Rebelo"
  },
  {
    "slug": "joaquim-barbosa",
    "nome_completo": "Joaquim Benedito Barbosa Gomes",
    "nome_urna": "Joaquim Barbosa",
    "cargo_disputado": "Presidente",
    "ids": {
      "camara": null,
      "senado": null,
      "tse_sq_candidato": {}
    },
    "wikipedia_title": "Joaquim_Barbosa"
  },
  {
    "slug": "renan-santos",
    "nome_completo": "Renan Antonio Ferreira dos Santos",
    "nome_urna": "Renan Santos",
    "cargo_disputado": "Presidente",
    "ids": {
      "camara": null,
      "senado": null,
      "tse_sq_candidato": {}
    },
    "wikipedia_title": "Renan_Santos"
  },
  {
    "slug": "ciro-gomes",
    "nome_completo": "Ciro Ferreira Gomes",
    "nome_urna": "Ciro Gomes",
    "cargo_disputado": "Presidente",
    "ids": {
      "camara": 141406,
      "senado": null,
      "tse_sq_candidato": {
        "2018": "280000605589",
        "2022": "280001612393"
      }
    },
    "wikipedia_title": "Ciro_Gomes"
  },
  {
    "slug": "hertz-dias",
    "nome_completo": "HERTZ DA CONCEICAO DIAS",
    "nome_urna": "Hertz Dias",
    "cargo_disputado": "Presidente",
    "ids": {
      "camara": null,
      "senado": null,
      "tse_sq_candidato": {
        "2018": "280000601174",
        "2020": "100000718146",
        "2022": "100001600008"
      }
    }
  },
  {
    "slug": "augusto-cury",
    "nome_completo": "Augusto Jorge Cury",
    "nome_urna": "Augusto Cury",
    "cargo_disputado": "Presidente",
    "ids": {
      "camara": null,
      "senado": null,
      "tse_sq_candidato": {}
    },
    "wikipedia_title": "Augusto_Cury"
  },
  {
    "slug": "cabo-daciolo",
    "nome_completo": "Benevenuto Daciolo Fonseca dos Santos",
    "nome_urna": "Cabo Daciolo",
    "cargo_disputado": "Presidente",
    "ids": {
      "camara": 178938,
      "senado": null,
      "tse_sq_candidato": {
        "2018": "280000602500",
        "2022": "190001643311"
      }
    },
    "wikipedia_title": "Cabo_Daciolo"
  },
  {
    "slug": "edmilson-costa",
    "nome_completo": "Edmilson Silva Costa",
    "nome_urna": "Edmilson Costa",
    "cargo_disputado": "Presidente",
    "ids": {
      "camara": null,
      "senado": null,
      "tse_sq_candidato": {
        "2010": "280000000018"
      }
    },
    "wikipedia_title": "Edmilson_Costa"
  },
  {
    "slug": "rui-costa-pimenta",
    "nome_completo": "Rui Costa Pimenta",
    "nome_urna": "Rui Costa Pimenta",
    "cargo_disputado": "Presidente",
    "ids": {
      "camara": null,
      "senado": null,
      "tse_sq_candidato": {
        "2002": "9570",
        "2006": "27",
        "2010": "280000000007",
        "2014": "280000000081"
      }
    },
    "wikipedia_title": "Rui_Costa_Pimenta",
    "estado": "SP"
  },
  {
    "slug": "samara-martins",
    "nome_completo": "SAMARA MARTINS DA SILVA",
    "nome_urna": "Samara Martins",
    "cargo_disputado": "Presidente",
    "ids": {
      "camara": null,
      "senado": null,
      "tse_sq_candidato": {
        "2020": "200000724019",
        "2022": "280001602703"
      }
    }
  },
  {
    "slug": "aecio-neves",
    "nome_completo": "Aecio Neves da Cunha",
    "nome_urna": "Aecio Neves",
    "cargo_disputado": "Presidente",
    "estado": "MG",
    "ids": {
      "camara": 74646,
      "senado": null,
      "tse_sq_candidato": {
        "2010": "130000000952",
        "2014": "280000000085",
        "2018": "130000613206",
        "2022": "130001613348"
      }
    },
    "wikipedia_title": "Aécio_Neves"
  },
  {
    "slug": "tarcisio-gov-sp",
    "nome_completo": "Tarcisio Gomes de Freitas",
    "nome_urna": "Tarcisio de Freitas",
    "cargo_disputado": "Governador",
    "estado": "SP",
    "ids": {
      "camara": null,
      "senado": null,
      "tse_sq_candidato": {
        "2022": "250001615967"
      }
    },
    "wikipedia_title": "Tarcísio_de_Freitas"
  },
  {
    "slug": "haddad-gov-sp",
    "nome_completo": "Fernando Haddad",
    "nome_urna": "Fernando Haddad",
    "cargo_disputado": "Governador",
    "estado": "SP",
    "ids": {
      "camara": null,
      "senado": null,
      "tse_sq_candidato": {
        "2012": "250000050277",
        "2016": "250000011576",
        "2018": "280000629808",
        "2022": "250001612465"
      }
    },
    "wikipedia_title": "Fernando_Haddad"
  },
  {
    "slug": "erika-hilton",
    "nome_completo": "Erika Santos Silva",
    "nome_urna": "Erika Hilton",
    "cargo_disputado": "Governador",
    "estado": "SP",
    "ids": {
      "camara": 220645,
      "senado": null,
      "tse_sq_candidato": {
        "2020": "250000686838",
        "2022": "250001613814"
      }
    },
    "wikipedia_title": "Érika_Hilton"
  },
  {
    "slug": "felicio-ramuth",
    "nome_completo": "Felicio Ramuth",
    "nome_urna": "Felicio Ramuth",
    "cargo_disputado": "Vice-Governador",
    "estado": "SP",
    "ids": {
      "camara": null,
      "senado": null,
      "tse_sq_candidato": {
        "2016": "250000038921",
        "2020": "250000693253",
        "2022": "250001615968"
      }
    },
    "wikipedia_title": "Felício_Ramuth"
  },
  {
    "slug": "ricardo-nunes",
    "nome_completo": "Ricardo Luis Reis Nunes",
    "nome_urna": "Ricardo Nunes",
    "cargo_disputado": "Governador",
    "estado": "SP",
    "ids": {
      "camara": null,
      "senado": null,
      "tse_sq_candidato": {
        "2012": "250000008046",
        "2014": "250000002150",
        "2016": "250000020813",
        "2018": "250000604021",
        "2020": "250000896547",
        "2024": "250002098117"
      }
    },
    "wikipedia_title": "Ricardo_Nunes_(político)"
  },
  {
    "slug": "geraldo-alckmin",
    "nome_completo": "Geraldo Jose Rodrigues Alckmin Filho",
    "nome_urna": "Geraldo Alckmin",
    "cargo_disputado": "Governador",
    "estado": "SP",
    "ids": {
      "camara": 65480,
      "senado": null,
      "tse_sq_candidato": {
        "2018": "280000602477",
        "2022": "280001607830"
      }
    },
    "wikipedia_title": "Geraldo_Alckmin"
  },
  {
    "slug": "gilberto-kassab",
    "nome_completo": "Gilberto Kassab",
    "nome_urna": "Gilberto Kassab",
    "cargo_disputado": "Governador",
    "estado": "SP",
    "ids": {
      "camara": 74778,
      "senado": null,
      "tse_sq_candidato": {}
    },
    "wikipedia_title": "Gilberto_Kassab"
  },
  {
    "slug": "andre-do-prado",
    "nome_completo": "Andre Luis do Prado",
    "nome_urna": "Andre do Prado",
    "cargo_disputado": "Senador",
    "estado": "SP",
    "ids": {
      "camara": null,
      "senado": null,
      "tse_sq_candidato": {
        "2018": "250000619454",
        "2022": "250001610161"
      }
    },
    "wikipedia_title": "André_do_Prado"
  },
  {
    "slug": "marcio-franca",
    "nome_completo": "Marcio Luiz Franca Gomes",
    "nome_urna": "Marcio Franca",
    "cargo_disputado": "Governador",
    "estado": "SP",
    "ids": {
      "camara": 141497,
      "senado": null,
      "tse_sq_candidato": {
        "2018": "250000615141",
        "2020": "250001012981",
        "2022": "250001615891"
      }
    },
    "wikipedia_title": "Márcio_França"
  },
  {
    "slug": "guilherme-derrite",
    "nome_completo": "Guilherme Muraro Derrite",
    "nome_urna": "Guilherme Derrite",
    "cargo_disputado": "Senador",
    "estado": "SP",
    "ids": {
      "camara": 204531,
      "senado": null,
      "tse_sq_candidato": {
        "2018": "250000605452",
        "2022": "250001611359"
      }
    },
    "wikipedia_title": "Guilherme_Derrite"
  },
  {
    "slug": "sergio-moro-gov-pr",
    "nome_completo": "Sergio Fernando Moro",
    "nome_urna": "Sergio Moro",
    "cargo_disputado": "Governador",
    "estado": "PR",
    "ids": {